{
  "$schema": "https://raw.githubusercontent.com/HuakunShen/opencode-design-lab/main/schemas/design-lab-config.schema.json",
  "design_models": [
    "kimi-for-coding/k2p6",
    "deepseek/deepseek-v4-flash",
    "deepseek/deepseek-v4-pro"
  ],
  "review_models": [
    "kimi-for-coding/k2p6",
    "deepseek/deepseek-v4-flash",
    "deepseek/deepseek-v4-pro"
  ],
  "base_output_dir": ".design-lab",
  "design_agent_temperature": 0.7,
  "review_agent_temperature": 0.1
}